{
  "$schema": "https://json-schema.org/draft/2020-12/schema",
  "$id": "https://bflabs.dev/schemas/geo-optimize-run-input.schema.json",
  "type": "object",
  "required": ["schema_version", "capability", "captured_at", "receipt", "evidence_sources"],
  "additionalProperties": false,
  "properties": {
    "schema_version": { "const": "1.0.0" },
    "capability": { "const": "geo-optimize" },
    "captured_at": { "type": "string", "format": "date-time" },
    "receipt": { "$ref": "repair-receipt.schema.json" },
    "evidence_sources": {
      "type": "array",
      "items": {
        "type": "object",
        "required": ["id", "summary", "source_type", "locator", "captured_at", "content_hash", "support_scope", "limitations", "dynamic_fact", "license"],
        "additionalProperties": false,
        "properties": {
          "id": { "type": "string", "pattern": "^ev_[a-z0-9_-]+$" },
          "summary": { "type": "string", "minLength": 1 },
          "source_type": { "enum": ["repository", "public-url", "user-supplied-observation", "fixture", "research"] },
          "locator": { "type": "string", "minLength": 1 },
          "captured_at": { "type": "string", "format": "date-time" },
          "content_hash": { "type": "string", "pattern": "^sha256:[a-f0-9]{64}$" },
          "support_scope": { "type": "string", "minLength": 1 },
          "limitations": { "type": "array", "items": { "type": "string" } },
          "dynamic_fact": { "type": "boolean" },
          "fact_version": { "type": ["string", "null"] },
          "license": { "type": "string", "minLength": 1 }
        }
      }
    }
  }
}
